{
  "schemaVersion": "1.0.0",
  "threadId": "66666666-6666-4666-8666-666666666666",
  "rootMessageId": "77777777-7777-4777-8777-777777777777",
  "cutoffMessageId": "88888888-8888-4888-8888-888888888888",
  "messageRefs": [
    {
      "messageId": "77777777-7777-4777-8777-777777777777",
      "revisionId": "ffffffff-ffff-4fff-8fff-ffffffffffff",
      "sequence": 0
    },
    {
      "messageId": "88888888-8888-4888-8888-888888888888",
      "revisionId": "99999999-9999-4999-8999-999999999999",
      "sequence": 1
    }
  ],
  "summaryRevision": 3,
  "summarizedThroughMessageId": "88888888-8888-4888-8888-888888888888",
  "attachmentRefs": [],
  "locale": "zh-TW",
  "timezone": "Asia/Taipei",
  "generatedAt": "2026-07-13T12:00:00.000Z",
  "manifestHash": "aaaaaaaaaaaaaaaaaaaaaaaaaaaaaaaaaaaaaaaaaaaaaaaaaaaaaaaaaaaaaaaa"
}
